	cause	effect
0	lack of communication between translink and event organizers.	A disruption in bus service in Gold Coast
1	the Philippines won the arbitration case against China over the disputed South China Sea.	Philippine Rodrigo Duterte called for a cabinet meeting
2	China's recent massive island reclamation following its unilateral territorial claim of 80 per cent of the whole sea under the nine-dash line.	The South China Sea dispute is one of the most pressing security issues in East Asia, especially with tensions boiling
3	they don't know for sure if it is another ploy by the Chinese	Regional countries are anxious
4	international law has not been fully respected.	The tension in the South China Sea is
5	it is a security issue in the middle of Southeast Asia.	The South China Sea dispute is an issue that directly affects four of the ASEAN countries, but indirectly affects the whole of ASEAN
6	a lack of an international enforcement mechanism.	The Hague award is legally binding yet whether it will be observed by relevant parties, particularly China
7	major countries expanding their defense budgets and attaching increasing importance to traditional security.	Global security governance has suffered a setback
8	China's growing influence in the region, Japan has been ramping up its efforts to oppose China in regional and international issues.	Due to its strained ties with China as a result of their territorial dispute and its concerns about having lost status
9	it is the current official coordinator of China-ASEAN relations, and will assume the presidency of ASEAN next year.	Singapore holds special significance to Chinese diplomacy
10	it perceives the so-called freedom of navigation operations as a major US strategy to check China's influence in the region.	The Donald Trump administration is continuing that practice, perhaps
11	they attempted to stir up tension between China and the Philippines	Individual persons in the Philippines laid indiscreet accusations towards China only
12	expansionist greed for capital and resources.	Wars occur
13	it could easily throw China-US relations off balance and squander the fruitful results achieved so far in advancing bilateral cooperation.	Trump discard the strategy of stirring up confrontation in the South China Sea is both dangerous and counterproductive
14	a third-party’s ability to order the state itself to pay large sums of money, which is understandably disconcerting for less familiar and stable nations.	Many nations are hesitant to participate in the ISDS framework
15	countries in the region have agreed to resolve their maritime disputes with China through dialogue.	"Using ""freedom of navigation operation"" as an excuse appears particularly ridiculous"
16	being thousands of miles away from Australia, China cannot possibly pose any direct threat to the country.	"Many Chinese still cannot understand why the ""China threat"" theory has been hyped from time to time in Australia,"
17	its aircraft, submarine and other vessels are not yet a cohesive force.	But compared with the high standards of some other countries' navies, China's general naval strength is not that satisfactory,
18	the disputes over sovereignty and jurisdiction of islands and reefs, marine resources and strategic sea lanes.	We should realize that China still faces maritime threats such as contradictions, frictions, even the threat of war
19	its national defense policy and strategy, not its military power.	A country poses a threat to other countries
20	they were often the first to be cut off when bilateral relations soured.	In the past, military exchanges were the vulnerable aspect of China-US relations,
21	the Shinzo Abe administration's refusal to face up squarely to history and its previous provocative actions.	It will definitely worsen relations between Beijing and Tokyo, which are already tense
22	it will destabilize the strategic balance in East Asia in favor of the United States.	Protests were organized after Lotte Group, a business conglomerate headquartered in South Korea, accepted a plot of land in exchange for its Skyhill Golf Course in Seongju where the US Terminal High Altitude Area Defense anti-missile system will be deployed, a move that China strongly opposes
23	the nation has never caused any harm to others.	There is no need for other countries to take caution against China's defense measures
24	Trump's unpredictability and the different opinions within the Cabinet	It remained to be seen whether Washington would follow up on Tillerson's proposal
25	there was a suspected breach of Hong Kong law	The Singaporean vehicles were impounded by customs on Nov 23
26	he is fully aware of the negative impact the US' strategic pivot to Asia	The reason that Duterte distanced his country from the US alliance is
27	the lack of resources and opportunities in our country.	Many Filipinos still suffer in poverty
28	"the Obama administration's ""rebalancing"" to the Asia-Pacific strategy and the deployment of THAAD, which makes them feel more secure"	Japan-ROK ties have indeed been improving not because of deepening mutual trust but
29	he doesn't want Washington's allies in Asia to believe the US has accepted China as an equal.	But Obama has been beating around the concept, possibly
30	a mighty military is a deterrence	A strong navy and a strong air force are crucial to safeguarding China's sovereignty in the South China Sea
31	the Trans-Pacific Partnership Agreement is aimed at furthering American interests.	The Trump administration may put it back on the policy agenda after revising the Trans-Pacific Partnership Agreement,
32	they have either helped create or provoked the maritime disputes in the waters themselves.	It only lays bare the hypocrisy of the US and its allies
33	China's longstanding territorial dispute with India and its spat with Japan over the Diaoyu Islands in the East China Sea.	They hope that an anti-China alliance could be forged between the world's second most populous nation and third-largest economy,
34	that can harm bilateral ties.	The last few months of the Obama administration should not be marked by heightened tensions between Beijing and Washington in the South China Sea,
35	a top White House advisor warned that Washington might revoke Hong Kong's special trading privileges if China enacts a tough new security law.	"Beijing has warned the US that it will take ""every necessary measure"" to protect its interests"
36	announcing at the weekend that the Paracel and Spratly islands, the Macclesfield Bank and their surrounding waters would be administered under two new districts of Sansha city, which China created on nearby Woody Island in 2012.	China angered Vietnam
37	it wanted the fish and sea turtles	Beijing was trying to seize Philippine seas
38	US President Donald Trump criticized Australian Prime Minister Malcolm Turnbull on the phone over a refugee resettlement agreement former US president Barack Obama had made between the two countries.	US-Australia relations becoming worse in February
39	then Australian Prime Minister Tony Abbott ignored a US warning in March 2015 and joined the Asian Infrastructure Investment Bank.	They expressed deep concern
40	Saudi Arabia's execution of a prominent Shiite cleric sparked attacks on two Saudi diplomatic posts in Iran, a move to show solidarity with the kingdom.	Qatar pulled its ambassador last year
41	ASEAN nations approved the framework of the COC.	China has proposed a three-step vision to step up consultations on the Code of Conduct (COC) in the South China Sea
42	meeting with Wang that to develop bilateral ties	Beijing and Manila have to seek joint exploration of natural resources to benefit the people of both nations.
43	the Yemeni government guaranteed that the missiles would only be used in Yemen and that it would not buy them again.	The ship was later released
44	losing the First Sino-Japanese War in 1895.	China was forced to cede Taiwan to Japan under the humiliating Treaty of Shimonoseki
45	Philippine President Rodrigo Duterte's visit to China.	Philippines' unilateral arbitration case against China, was peacefully resolved
46	creation of the Gulf-Pearl Chain	the real multilateral success will come
47	it is aimed at furthering American interests	Trump administration may put Trans-Pacific Partnership Agreement back on the policy agenda,
48	his state visit in October significantly improved China-Philippine ties.	Philippine President Rodrigo Duterte is expected to visit China again and attend an international summit,
49	the top Philippine diplomat refused China’s proposal to put aside the recent ruling in an arbitration case concerning the South China Sea	"Beijing has urged Manila to ""walk out of its wrong path"""
50	the arbitration ruling was announced.	Beijing issued two statements immediately
51	the Trump administration's threats over maritime disputes China	Beijing says it will protect its territory
52	the border standoff at Donglang Doklam last year.	, Central China's Hubei province signaled the warming up of Sino-Indian relations
53	Washington's miscalculations of what China has done in its attempt to defend its own territorial waters	he provocative actions US warships have repeatedly taken in the South China Sea
54	the flaring of regional tensions over the South China Sea disputes	Bilateral relations suffered a setback in 2016
55	the joint efforts of China and regional countries.	the situation in the South China Sea has been stabilized and cooled down
56	nuclear sanctions.	The military and defence relations between China and Iran dates to 1980’s but co-operation saw downfall
57	the US complaints about its trade deficits with China.	Possible showdown between the top two economies
58	Crimea crisis.	"His willingness to ""reset"" US relations with Russia has resulted in relations between Washington and Moscow have worsened"
59	friction among nations in the region.	East Asia integration is weakening
60	the majority of Singaporeans being of Chinese origin.	China-Singapore relations are resilient
61	terror attacks and the South China Sea disputes.	France and the Philippines are losing their attraction
